{
  "$schema": "https://json-schema.org/draft/2020-12/schema",
  "title": "Device",
  "description": "Core additionally requires unique component and connection IDs, unique capability references per component, and exactly one shared or component-scoped definition for each reference. Rediscovery preserves established connection bindings for a local device ID; comparing identities requires the runtime domain check.",
  "type": "object",
  "properties": {
    "schema_version": {
      "const": "1.0"
    },
    "id": {
      "type": "string",
      "minLength": 1
    },
    "alias": {
      "type": "string",
      "minLength": 1
    },
    "brand": {
      "type": "string",
      "minLength": 1
    },
    "model": {
      "type": "string",
      "minLength": 1
    },
    "components": {
      "type": "array",
      "items": {
        "$schema": "https://json-schema.org/draft/2020-12/schema",
        "title": "Component",
        "type": "object",
        "properties": {
          "id": {
            "type": "string",
            "minLength": 1
          },
          "capabilities": {
            "type": "array",
            "items": {
              "type": "string",
              "minLength": 1
            },
            "minItems": 1
          }
        },
        "required": [
          "id",
          "capabilities"
        ],
        "additionalProperties": false
      },
      "minItems": 1
    },
    "connections": {
      "type": "array",
      "items": {
        "$schema": "https://json-schema.org/draft/2020-12/schema",
        "title": "Connection",
        "description": "The complete connection tuple is a stable binding. Rediscovery may reorder bindings but cannot silently replace, add, or remove them. identity_ref is a stable local reference, not a changing network address or credential. ADR-0052 permits a separate trusted native same-identity append operation; this JSON shape provides no linking authority.",
        "type": "object",
        "properties": {
          "id": {
            "type": "string",
            "minLength": 1
          },
          "adapter": {
            "type": "string",
            "minLength": 1
          },
          "transport": {
            "enum": [
              "lan",
              "cloud"
            ]
          },
          "account_id": {
            "type": [
              "string",
              "null"
            ]
          },
          "identity_ref": {
            "type": "string",
            "minLength": 1
          }
        },
        "required": [
          "id",
          "adapter",
          "transport",
          "account_id",
          "identity_ref"
        ],
        "additionalProperties": false
      },
      "minItems": 1
    },
    "support_status": {
      "enum": [
        "planned",
        "mock-tested",
        "experimental",
        "verified",
        "blocked",
        "unsupported"
      ]
    }
  },
  "required": [
    "schema_version",
    "id",
    "alias",
    "brand",
    "model",
    "components",
    "connections",
    "support_status"
  ],
  "additionalProperties": false
}
